texto,sentimento
Muito exemplo prtico que facilita a absoro do contedo As dicas e os resumos no final dos captulos tambm so timo,satisfação
 uma leitura lenta porque te faz refletir a cada pgina que voc l e rel Os ensinamentos desse livro so extremamente valiosos No tenho contras daria certamente uma cpia do livro de presente a qualquer amigo,satisfação
Boa NoiteO livro  excelenteMas seria timo se quem j tem o livro pudesse ter uma verso digital gratuitaTenho problema de viso e ler no celular ou tablet  bem melhor,satisfação
Nada de extraordinrio,neutro
Um livro maravilhoso que vale a pena ler e reler  Testemunhos de superao rumo a jornada da evoluo diria no relacionamento humano,satisfação
 um manual de como fazer amigos e influenciar pessoas aquele livro que quando vc l se pergunta como no tinha lido antesCumpre com o que dizLinguagem de fcil entendimento,satisfação
Leitura obrigatria para todo mundo que queira viver melhor em sociedade ajuda em todos os relacionamentos Uma obra prima,satisfação
Um livro excelente que possibilita assimilar muito bem seu contedo com leitura simples e que realmente possibilita aspectos para mudanas comportamentais,satisfação
Livro excelente com uma didtica impressionanteSer de grande valia para o dia a dia de qualquer pessoaBoa leitura,satisfação
O livro contm princpios sobre o relacionamento humano que apesar de parecerem simples e modestos mas so sinceramente essenciais para mantermos boas relaes com todos,satisfação
Entrega dentro do prazo Produto conforme anunciado,neutro
Livro fantstico deve ser sempre revisitado para tirar dele todo o ensinamento possvelMuda o pensamento e como nos relacionamos com os outros,satisfação
Maravilhoso leitura leve e gostosaNo primeiro dia voc j se decide a mudar as atitudes porque o que l faz sentidoNo  a toa que continua na lista de mais vendidos do mundo,satisfação
Simplesmente um timo livro que todas as pessoas deveriam ler independente de sua rea de atuao profissional ou classe social far bem e acrescentar muito valor na vida de qualquer pessoa,satisfação
Fala algumas coisas bvias mas que precisam ser ditas Um bom livro para introvertidos assim como eu,satisfação
Gostei muito desse livro ele fala de coisas que at parecem bvias mas a gente acaba nao praticando Recomendo,satisfação
 uma obra prima que resume bem a obra de Dale Carnegie,satisfação
O princpio do livro  muito atual  raro hoje colocar o outro em evidncia tratar como gostaria de ser tratado e olhar sob a perspectiva do outro para ter boas relaes Livro bem escrito e de leitura fluida Recomendo,satisfação
O livro  muito interessante se voc gosta e tem interesse em desenvolvimento pessoal  o livro ideal A nica coisa que no gostei muito  que o livro d muitos exemplos o livro todo tirando isso o livro  incrvel,satisfação
Vale cada centavo Impossvel terminar esse livro sem tirar nenhuma lio,satisfação
O livro possui uma linguagem e modo de escrita que fazem no querer parar O contedo  to pertinente e atual que parece ter sido escrito esse ano  um livro divisor de guas,satisfação
Apesar de ser to antigo tudo que mostra se mantm firme at hojeCom exemplos de pessoas reais que seguiram o que foi ensinado e colhendo bons frutos  pessoais quanto  profissionais,satisfação
A primeira vez que o li a anos atrs fez grande diferena na minha perspectiva sobre relacionar com as pessoas  o melhor livro que j li,satisfação
Mais de 50 anos e continua sendo um dos melhores livros de como ser uma pessoa melhor Voc vai ser melhor com voc e com os outros Livro para ser relido vrias e vrias vezes  livro de cabeceira,satisfação
Livro excelente mas uma coisa nunca se esquea nunca deixe de ser voc mesmo Nem sempre voc precisa agradar todo mundo ainda mais quando o outro no compactua com seus valores,satisfação
Amei o livro Sem contar que  tudo o que eu compro no Amazon chegar sempre antes Muito satisfeita com a Amazon Obrigada,satisfação
Muito bom Fcil de ler e entender seu contedo Muito til para aprender ou aprimorar os relacionamentos pessoais e profissionais,satisfação
Tenho lido a todo momento durante minha folga Leitura que te estiga a no parar de ler e agregar conhecimento para a vida Livro pra ler e reler sempre,satisfação
Cmo fazer amigos e influenciar pessoas  um livro fantsticoAs orientaes do autor so excelentesEu super recomendo a leitura desse livro,satisfação
Muito bomO autor trabalha numa linguagem simples a forma de desenvolver e aprimorar as relaes humanasVale a leitura,satisfação
Recomendo este livro a todas as pessoas afinal temo relaes direta com pessoas diariamente,satisfação
Livro que precisa ser lido por qualquer um que queira se relacionar melhor com as pessoas ao seu redor Trs exemplos que apesar de antigos so bastante coerentes e explicam muito bem os conceitos,satisfação
Livro repleto de lies prticas para lidarmos compreendermos e exercermos maior influncia nas pessoas que fazem parte do nosso crculo de relacionamento,satisfação
Livro muito bom realmente incrivel o contedo desse livro serve tanto para as relaes entre familia amigos e at nos negcios Recomendo muito,satisfação
Muito bom o livro fala como devemos nos comunicar com as pessoas de forma que no ofendendo as pessoas com palavras que no percebemos que pode magoar,satisfação
O material  timo e a impresso muito boa Chegou intacto sem qualquer amassado ou problema O contedo do livro  de excelente qualidade para quem gosta de livros do gnero,satisfação
Livro sensacional que no envelheceu com o tempo Seus ensinamentos e exemplos so aplicveis at hoje e continuaro a ser por muitos sculos,satisfação
Sensacional fantstico muito bom super didatico com exemplos autoexplicativo prende a ateno faz querer ler mais e mais bom mesmo,satisfação
No vou entrar na questo da qualidade do livrodo texto do autor E sim da qualidade do produto entregue Veio todo cheio de manchas e arranhes me decepcionei bastante com o estado da capa do livro,insatisfação
chegou a compra conforme eu tinha combinado e melhor que pensei,satisfação
Livro bom,satisfação
O livro  fantstico claro mas a verso que recebi parece muito antiga no  verso atualizada Mas s me atentei a isso depois que j tinha passado o prazo de devoluo,satisfação
Livro muito bom recomendo,satisfação
Fantstico indispensvel para relaes interpessoaisEstou comprando outros para dar de presente s pessoas que gosto assim como procurando outros livros do mesmo autor,satisfação
O livro  lindo meio emborrachado e chegou em perfeito estado,satisfação
Um dos melhores livros que j li na minha vida  aquele tipo que voc sente a necessidade de ler e reler sempre Mantm na mesa pra consultar sempre que precisa,satisfação
Um contedo muito interessante sobre negociao relaes humanas Indico muito Deveria estar como livro bsico para todos lerem Livro atemporal ,satisfação
Essa leitura  recomensada  todos leve prtica objetiva eficaz e atemporal Se encaixa perfeitamente nas tratativas interpessoais de qualquer pessoa que preze pela boa vida,satisfação
Tanta coisa boa nele que fiquei perdida na leitura  tudo de bom Dou at 200 estrelas,satisfação
Para uma boa comunicao recomendo,satisfação
Que livro Vale muito a pena a leituraEle traz pontos que pode ser usado no diadia nas relaes com pessoas e tambm super aplicvel no trabalho em negociaes,satisfação
timo pois o conhecimento que este livro passa muda as formas de pensar agir  com as pessoas e com isso tornarcriar relacionamentos saudveis com essas,satisfação
Satisfao total e muito agradecido com o comprometimento da Amazon em suas entregas fiz o pedido no dia 0509 de madrugada quando foi hoje a tarde 0809 j entregaram maravilhoso super recomendo,satisfação
Leitura obrigatria para quem deseja sucesso profissional e melhorias em todos os relacionamentos Um dos melhores livros que j li,satisfação
Livro muito bom e interessante trs uns  insights para a vida de fato Acredito que deveria ser como um paradidtico nas escolas ajudaria bastante no desenvolvimento pessoal,satisfação
                    A mdia no pde ser carregada                 Ansiosa para ler hegou em perfeito estado,satisfação
Gosto de comprar na Amazon sempre supera minhas espectativas na entrega sempre bem embalados os produtos Livro muito top e atual apesar de ter sido lanado a muito tempo atrs,satisfação
Eu mal iniciei a leitura e j estou adorando os exemplos e orientaes dadas nesse livro Eu sempre estou em meio a vrias pessoas principalmente estudantes ento com certeza ir potencializar minha boa relao com as pessoas,satisfação
Livro que faz a gente rever as nossas aes e tentar melhorar como pessoa simplesmente fantstico,satisfação
Chegou antes da data prevista Td certinho,satisfação
                    A mdia no pde ser carregada                 Acabei de retirar o livro da embalagem e a surpresa foi o livro estar descolando Fiz questo de comprar um novo para no ter esse tipo de problema Decepcionada,insatisfação
Deveria ser obrigatrio  ler esse livro Fiz o curso do Dale tambm e foram excepcionais para a minha carreira profissional,satisfação
Simplesmente essencial para uma melhor comunicao e entendimento de como funciona o trato com as pessoas Esse livro mudou minha vida,satisfação
Todos deveriam ler esse livro pois te alavanca na carreira e faz voc saber se comunicar com as outras pessoas de forma leve,satisfação
Modstia parte eu sou um vido leitor N entrando havia muito tempo que eu no esbarrava em um livro to bom diante do que se prope Leitura obrigatria,satisfação
Entregue em 3 dias maravilhoso,satisfação
Fiquei simplesmente apaixonada por esse livro nunca tinha visto algo parecido traz com clareza como devemos tratar as pessoas para sermos amadas recomendo a todos,satisfação
O produto chegou no tempo estimado e em timo conservao a minha nota  questo de tempo de entrega e cuidado com o produto veio embalado e lacrado excelente,satisfação
O nico problema e que tem muitos exemplosMais e timoj aprendi muito lendo apenas 10 pginas,satisfação
Sem comentrios,satisfação
Bem embalado perfeito estado e entrega hiper rpida ,satisfação
Gostei muito das lies ensinadas no livro realmente muito inspirador para o dia a dia,satisfação
Livro com folhas bem cheirosas e capa bonita Leitura maravilhosa para a vida toda,satisfação
Se aplicados os princpios do livro podem fazer muita diferena no s no trabalho mas na vida pessoal tbm Vale a pena ler,satisfação
Uma boa leitura para relembrar o que j sabemos mas no conseguimos muitas vezes adotar Serve como reflexo e melhora de qualidade de vida ,satisfação
Todos deveriam ler esse livro Muito bom,satisfação
Excelente Estou fazendo o treinamento e realmente  impactanteAprendemos a vivenciar com uma nova mentalidade e assim vivemos uma nova realidade,satisfação
Um livro sensacional que muitas pessoas deveria ler e aplicar Mudou muito minha mentalidade,satisfação
O produto veio intacto e sem amassados,satisfação
O contedo do livro  timo os ensinamentos so super teis e atualizados Porm a capa deixa a desejar Alm de ser fosca e mole  feita de um material grudento e suja muito,insatisfação
Gostei bastante do livro porm senti que ele  um pouco repetitivo da parte 3 para a 4,satisfação
Um contexto bom sobre formas diferentes de abordagem pessoal e profissional Vale a pena a leitura,satisfação
Eu super recomendo esse livro Ajuda muito estou encantada com o autor e j li outro dele e vou ler mais,satisfação
 realmente uma fonte inesgotvel de dicas valiosas com exemplos prticos sobre como podemos nos relacionar melhor Recomendo a compra  til por toda a vida,satisfação
Em perfeitas condies bem embalado e entrega rpida e dentro do prazo adorei,satisfação
Gostei muito deste livro O mais interessante  que o autor vai argumentando sobre cada subtema e para fortificar sua argumentao ele dar vrios exemplos de acontecimentos reais,satisfação
Estava muito ansiosa por essa chegada e a pesar de no concludo  me apaixonei por cada pgina  Em breve comprei os semelhantes ,satisfação
Dicas valiosssimas sobre relaes humanas Apliquei alguns conceitos e o resultado foi imediato Recomendo,satisfação
Livro com contedo bom  mas exemplos muito antigos,neutro
Toda pessoa tem q ler este livro nos faz ser melhores seres humanos,satisfação
                    A mdia no pde ser carregada                 Gostei da qualidade do produto e da embalagem principalmente,satisfação
Bom,satisfação
Melhor livro de autoajuda  desenvolvimento pessoal que j li Simplesmente fantstico,satisfação
Um guia definitivo de relaes humanas recomendo a todos no  um livro para gerentes CEO ou vendedor  um livro para qualquer pessoa que deseje melhorar suas relaes humanas,satisfação
Livro de tamanho mdio Qualidade boa,satisfação
Chegou como o esperado,satisfação
Recomendo a Compra Entrega na data Prevista E uma excelente leitura todos deveriam ler,satisfação
Adorei Chegou rpido menos de 1 semana desde que fiz o pedido literalmente chegou em dois dias e veio muito bem embalado,satisfação
Gostei muito do livrome deu vrios insights de como mudar o tratamento com as pessoas mesmo em situaes difceis delicadas ou sob presso recomendo,satisfação
Conforme o anncioSobre o envio a entrega sensacional de sempre chegando antes da data marcado para ser entregue,satisfação
Excelente livro Conceitos aplicveis a todas as reas da vida Leitura obrigatria para lideres Recomendo muitssimo,satisfação
O produto foi entregue de maneira rpida  exatamente conforme descrito pelo vendedorEstou muito satisfeita,satisfação
O livro de texto leve e de fcil entendimento  melhor do que eu esperava A maioria das lies so aplicveis,satisfação
Livro simplesmente espetacular Talvez sirva mais para alguns que para outros mas acredito que se todas as pessoas lessem as relaes se tornariam muito mais fluidas NO MINIMO,satisfação
Um livro com princpios e ideias sensacionais que ensinam como lidar com as pessoas e o real sentido disso que  usando a empatiaSimplesmente sensacional,satisfação
Fezme mudar o modo de debater e de v as outras pessoas,satisfação
Uma verdadeira obra prima Livro atemporal com conselhos valiosssimos,satisfação
RECOMENDO,satisfação
Super indico me ajudou a perceber quanto eu estava errando ao me relacionar com pessoas Voc vai aprender princpios fceis de serem aplicados,satisfação
 um livro fantstico de leitura simples e muito rica O autor nos d dicas que colaboram para que tenhamos sucesso nos relacionamentos sociais na vida pessoal e profissional,satisfação
Excelente,satisfação
So hbitos simples q com um toque de percepo e dedicao a alguns tpicos podem mudar a forma como as pessoas te tratam ou podem tratar no futuro,satisfação
incrvel,satisfação
Produto em excelente estado Entrega super rpida Feliz com a aquisio,satisfação
Livro  maravilhoso te faz refletir sobre vrias coidas,satisfação
Essa deveria ser uma leitura obrigatria para todos,satisfação
Um livro fundamental para os que procuram transcender os prprios conhecimentos ensinando uma maneira de se conectar de forma adequada a outros indivduos,satisfação
Um dos melhores que j li No  a toa que foi recomendado por Buffett Leitura bem fcil e agradvel,satisfação
timo livro para reflexes de relaes interpessoais de forma prtica levanta diversas atitudes simples a serem usadas por qualquer pessoa para melhorar suas relaes,satisfação
Ainda estou lendo o livro porm apresenta uma didtica muito boa e  lido facilmente,satisfação
Produto chegou bem embalado Comeando a leitura timo ,satisfação
Muito bom aprendendo muito,satisfação
Muito bom,satisfação
Gostei muito das experincias prticas de diversas pessoas no livro que nos ajudam a ver como podemos aplicar cada ensinamento no nosso dia a dia,satisfação
Muito bom o livro ajuda bastante no desenvolvimento pessoal e profissional de todas as pessoas que tem vontade de aprender,satisfação
timo para vendas,satisfação
Livro maravilhosodeveria ser dado para cada ser humano ler quando crianapara quando atingir a idade adulta ter mais empatia no trato com as pessoas,satisfação
Excelente livro Recomendo,satisfação
Livro muito bom apesar de ter sido escrito na dcada de 1930 seus ensinamentos so muito teis para os dias de hoje,satisfação
Veio rpido e em perfeito estado maravilhoso,satisfação
A entrega mais rpida que j tive Recebi no outro dia Agora bora pra leitura Li a amostra no Kindle e j adorei,satisfação
chegou perfeito estado os livros,satisfação
 bom trs vrios exemplos legais e de modo geral ensina bastante Boa leitura de domingo Tem que escrever mais 4 palavras,satisfação
livro veio muito bem embalado sem amassados entrega muito rpida,satisfação
Entrega perfeita Ok,satisfação
Um dos melhores livros se no o melhor de relaes pessoais,satisfação
Livro bem fundamentado,satisfação
Surpreso e satisfeito com a velocidade da entrega O pagamento do produto foi confirmado ontem de manh e hoje j recebi ele Veio em perfeito estado,satisfação
Ainda estou na pgina 90 mas o livro j est me ajudando muito nas vendas,satisfação
O produto  de tima qualidadeO livro  maravilhoso mudou minha forma de pensar a respeito das outras pessoas contedo indispensvel,satisfação
Esse livro foi incrvel devorei em poucos dias Indico muito pra todo mundo que quer ter relaes mais conscientes pessoais e profissionais,satisfação
Livro bonito filhas grossas amarelas letras grandes muito bem editado,satisfação
Superr recomendado este livro Para todo tipo de publicoTe ajuda com auto estima e tem todos os requisitos necesarios,satisfação
No tem como descrever a perfeio que  esse livro,satisfação
 um livro que todos deveriam ler independente de profisso conhecimento contatos etc O livro  praticamente um manual da comunicao e bons modos,satisfação
Muito bom ,satisfação
Bons conselhos de forma prtica e fcil de entender,satisfação
Chegou antes do prazo Li a primeira parte e j gostei muito Recomendo pra todos,satisfação
Entrega excelente Chegou em perfeito estado e antes do prazo,satisfação
Muito bom,satisfação
timo livro leitura surpreendente e inspiradora recomento,satisfação
Vrias dicas,satisfação
Produto muito bom chegou bem conservado e protegido MUITO RAPIDO E vale muito a pena ,satisfação
At minha filha de 14 anos leu e adorou,satisfação
Maravilhoso o livro chegou em perfeito estado entrega super rpida,satisfação
Bom saber como certas coisas no mudam com o tempo,satisfação
Livro mostra que o segredo da boa comunicao  ter empatia com os outros,satisfação
Um manual para praticamente todas as situaes mais validas ainda pra quem trabalha com vendas,satisfação
Chegou perfeitamente bem embalado e t doida pra iniciar a leitura,satisfação
Livro timo recomendo leitura,satisfação
Produto bem embalado e folhas amarelinhas facilitando uma leitura no cansativa,satisfação
Produto veio danificado na ponta ainda meio esverdeado como se fossem fungos,insatisfação
Sua vida vai se transformar aps ler este livro,satisfação
Excelente livro para quem est precisando melhorar nas relaes interpessoais O autor faz atravs de exemplos voc melhorar na forma como lidar com as pessoas,satisfação
Muito bom excelente viso,satisfação
Um timo livro tanto para se relacionar melhor quanto para melhorar o autoconhecimento,satisfação
Fundamental para as relaes interpessoais,satisfação
Produto bem embalado e entregue corretamente,satisfação
timo livro,satisfação
exdcelnete,satisfação
Livro timo para aprender a lidar com as pessoas,satisfação
O produto chegou bem embalado antes do prazo super recomendo,satisfação
Melhor livro sobre relacionamento humano que existe,satisfação
Realmente  um dos poucos livros que fazem a mudana no nosso jeito de pensarVale a pena o investimento,satisfação
Gostei muito do livro,satisfação
Todo mundo deveria ler,satisfação
O Livro veio com uns amassos na capa,neutro
H tempos queria e comprei por um preo timo,satisfação
Parece uma simples livro de autoajuda mas creio que TODO MUNDO deveria ler  um pequeno manual bsico de como agir em sociedade,satisfação
Um livro impar Imprescindvel para quem trabalha e lidera equipes Em 2030 Este livro continuar sendo atual Recomendo a leitura e releitura,satisfação
Muito bem embalado,satisfação
timo livro,satisfação
Um dos melhores livros que j li sem dvidas E a entrega dentro do prazo,satisfação
Passou um pouco do prazo de entrega mas isto j foi erro meu No tenho oq comentar do contedo do livro,satisfação
O livro nos estrutura e nos da exemplos claros daquilo que Jesus nos ensinou quando veio ao mundo simples assim,satisfação
Muito bom,satisfação
O livro chegou na data prevista para a entrega chegou em bom estado e bem lacrado,satisfação
Um ritual de boas prticas educacionaisVai variar do seu perfil e do seu temperamento Mas vale o aprendizado,neutro
O livro  muito bom mas chegou bastante amassado,neutro
Muito maravilhoso melhor livro que j li na minha vida j tinha escutado muito sobre ele e superou minhas expectativas,satisfação
Excelente sem comentrios,satisfação
Ttulo do livro pode at enganar a leitura vai bem mais alm ao que o ttulo de prope tima leitura,satisfação
Adorei o livro vale muito a leitura,satisfação
Esse livro  embaado emSuper recomendo pra quem tem dificuldades de se relacionar com as pessoas,satisfação
timo livro,satisfação
O livro foi me recomendado  realmente muito bom,satisfação
Livro nota 10 transformador recomendo,satisfação
Todo mundo deveria ler esse livro,satisfação
Estou com 47 anos gostaria te ter lido este livro pela primeira vez h uns trinta anos atrs Mas nunca  tarde para comear ,satisfação
Livro indispensvel para quem deseja lidar com pessoas Chego novinho sem nenhum amassado,satisfação
 um excelente livro,satisfação
Estou aprendendo muito,satisfação
tima leitura livro muito bom,satisfação
Livros excelente com dicas que realmente fazem a diferena,satisfação
Com certeza  muito obrigatrio,satisfação
Leitura maravilhosa entrega rpida,satisfação
Ok,satisfação
Incrvel entrega no dia seguinte,satisfação
timo Produto  chegou muito rpido e o livro  muito top ,satisfação
Sensacional  melhor livro que j li,satisfação
O LIVRO foi indicado e amei,satisfação
,satisfação
O livro possui uma linguagem clara objetiva com muitos exemplos aplicados o que torna ainda mais real,satisfação
Ensinamentos atemporais que todos deveriam ler Me arrependo de no ter lido antes Recomendo,satisfação
Livro muito interessante que ajuda demais nas relaes interpessoais Recomendo bastante,satisfação
Muito bom,satisfação
Livro excelente e necessrio parar TODOS Todo mundo deveria ler,satisfação
Gostei muito,satisfação
Livro maravilhoso Super indico,satisfação
timo livro,satisfação
Muito bom,satisfação
Livro muda sua percepo do mundo,satisfação
timo livro,satisfação
Livro excelente que traz ensinamentos para a vida Ler e reler,satisfação
Perfeito apenas leiam e pratiquem o que est escrito,satisfação
Chegou no dia certinho e muito bem embalado,satisfação
O livro  mto bom,satisfação
Livro fcil de ler e fundamentos necessrios para um bom relacionamento,satisfação
Este livro  uma importante fonte de conhecimento,satisfação
Muito bom bem embalado os produtos,satisfação
Entrega muito rpida 100 satisfeito,satisfação
timo melhor impossvel chegou antes do prazo esperado ,satisfação
Produto chegou perfeito,satisfação
Excelente livroRecomendo muito,satisfação
Eu amei Muitas pessoas me indicaram ele,satisfação
Ainda no iniciei a leituraMas foi muito indicada por quem j leu,satisfação
Livro curto e timo de ler,satisfação
Um dos melhores livros que j li na vida apliquei as lies e elas funcionaram automaticamente,satisfação
Livro de Excelncia,satisfação
Livro excelente Relendo,satisfação
adorei o livro  de fcil intendimento muitos exemplos prticos e atuais indico a todos,satisfação
muito bom,satisfação
Melhor livro do mundo ,satisfação
Chegou em perfeito estado e muito rpido excelente leitura,satisfação
Muito bom,satisfação
Livro maravilhoso linguagem direta e o contedo  sensacional ,neutro
entrega rapidamelhor preo,satisfação
vou comprar mais,satisfação
Chegou bem antes do prazo ,satisfação
Amei  chegou perfeito e muito rpido,satisfação
Livro sensacional,satisfação
Muito bom Livro,satisfação
Muito bom,satisfação
Recomendo,satisfação
Livro de fcil compreendimento,satisfação
Um dos melhores livros que j li,satisfação
O livro veio em timo estado,satisfação
Livro til em qualquer poca,satisfação
Muito bom veio bem embalado e chegou rapidamente,satisfação
Gostei,satisfação
Amando a leitura,satisfação
Amei o livro,satisfação
Rpida entrega e lindo livro,satisfação
timo,satisfação
Amei o livro super recomendo aproventem,satisfação
Livro chegou em timas condies,satisfação
Produto muito bom,satisfação
timo livro chegou rpido na minha casa Obrigado Amazon,satisfação
timo livro,satisfação
Excelente contedo com bons exemplos a serem aplicados,satisfação
ansiosa para ler,satisfação
timo produto,satisfação
Realmente faz o que promete fazer,satisfação
Excelente livro ,satisfação
EXELENTE,satisfação
Maravilhoso,satisfação
Muito Bom,satisfação
Bom,satisfação
