texto,sentimento
O universo  composto de 845 de matria escura uma forma de matria que temos muita dificuldade de detectar  apesar de seu significativo impacto na realidade Como fazer amigos e influenciar pessoas  um destes livros que  como matria escura do pensamento contemporneoNo o vemos ganhando destaque em crculos intelectuais na academia ou sendo aclamado como queridinho pelas estrelas da cultura pop Pelo contrrio  comum ler crticas menosprezandoo como bobagem de autoajuda Apesar desta reputao o livro  onipresente  difcil no encontrlo em posies de destaque em livrarias de rodovirias aeroportos ou shoppings Onde quer que se v l est Dale Carnegie O que h de to especial aquiA promessa do livro  que a maior parte do sucesso no est na tcnica e sim em como relacionarse com outros seres humanos Para isso apresenta regras que separo livremente em 3 sees1 Como tornarse uma pessoa mais amigvel2 Como conversar demonstrando respeito pelas outras pessoas3 Como incentivar mudanas de atitude e comportamento lideranaA primeira parte possui um ar filosficoreligioso nos convidando a abandonar o hbito da queixa crtica e condenao dos demais  costume que j era popular muito antes do tempo do autor e permanece at hoje E por que reparas tu no argueiro que est no olho do teu irmo e no vs a trave que est no teu olho Mateus 73 No se queixe da neve no telhado da casa do seu vizinho quando a soleira da sua porta no est limpa ConfcioA segunda parte  sobre empatia O incentivo  para demonstrar respeito  pessoa com quem se fala levando em considerao seus sentimentos ao invs de somente falar o que desejamos Isso significa tanto regras que so exemplos de bom senso como Procure honestamente ver as coisas do ponto de vista da outra pessoa quanto pontos no to bvios como A nica maneira de ganhar uma discusso  evitlaPor ltimo o livro apresenta conselhos sobre como um lder deve se comunicar para melhorar o comportamento da sua equipe Assim como na segunda parte o foco est em como comunicarse com respeito ao outro  especialmente ao efetuar uma correo necessria Fale sobre os seus erros antes de criticar os de outra pessoaDo ponto de vista de estilo o livro traz muitos exemplos antigos de como aplicar as regras como cartas muito formais impensveis nos anos 2020 que so um charme  parte datando a obra de uma maneira delicada e reforando a sua identidade Alm disso tambm possui histrias que despertam os sentimentos mais nobres em ns sendo uma leitura inspiradora  daquelas que do vontade de iniciar mudanas na vida imediatamenteComo fazer amigos e influenciar pessoas  um livro de quase 100 anos de idade e que permanece atual merecendo seu lugar de destaque junto com Napoleon Hill no panteo de autoajuda e desenvolvimento pessoal Li este livro depois de ter passado por muitos outros autores contemporneos de autoajuda e compreendi que muitas das ideias que vemos no setor na verdade so modificaes  derivaes  atualizaes do que j foi falado aquiRecomendado para quem busca desenvolverse como ser humano e quer se tocado pelo esprito criador do sculo XX,satisfação
Desde criana sempre ouvi falar sobre esse livro todos falavam que era um timo livro que realmente fazia diferena na vida das pessoas que o liam e realmente utilizavamse dos conselhos descritos nele Porm sempre tive um p atrs com o livro  aquele velho ditado Nunca julgue um livro pela capa entretanto era o que eu fazia com esse S agora em 2020 em plena quarentena resolvi comprar esse livro comecei a ler a achei to interessante e envolvente que li em apenas uma noite e uma manh E mesmo sendo lanado em meados de 1938 essa obra ainda  MUITO atual revelando que as interaes humanas no se modificam com o passar do tempo tanto  que se voc ler o livro e interpretalo no contexto atual voc ter a impresso que ele foi escrito recentemente Portanto se a pessoa comprar no intuito de ter uma relao interpessoal melhor  certeza que ir conseguir desde que utilizase dos princpios nele descrito A parte inicial dos 6 primeiros princpios em relao a amizade so coisas to comuns que voc j at imagina mas talvez nunca tenha dado total importncia a isso e ao ler voc nota que realmente so coisas que fazem a total diferena basta ler e interpretar como se algum estivesse fazendo esses princpios com voc Se aps a leitura voc realizar ao menos 50 dos princpios pode ter certeza que sua vida em relao a amizades ir melhorar e muito No   toa que esse livro mesmo aps mais de 80 anos do lanamento ainda seja um dos mais vendidos do mundo O nico arrependimento que eu tenho  de ter lido antes quando eu era bem mais novo,satisfação
Adquiri esse livro por pura curiosidade pois ao entrar em qualquer livraria essa  a prima obra que chega aos olhos de quem est entrando estando sempre nas primeiras prateleiras e vidrarias Por conseguinte realizei a leitura de parte da obra Os pontos principais se resumem em ser bom ser tolerante estar realmente interessado no que o outro tem a falar e ser tolerante Desse modo no julgo quem acha esse livro um divisor de guas mas para qualquer indivduo minimamente politizado  simples perca de tempo alm de estar totalmente desatualizado Para curiosos de planto que vivem em cavernas no sculo XXI talvez possa valer a pena mas para demais indivduos duvido da necessidade dessa leitura,neutro
Uma obra prima realmente que trata da principal atribuio social que o ser humano deve ter na minha opinio a empatia Alis os melhores livros de negcios so em realidade livros sobre pessoas sobre escutlas de verdade para entendlas profundamente aumentando sua percepo sobre elas e ao mesmo tempo sobre voc mesmo  tambm sobre procurar acordos dadas as vrias nuances que o ser humano vai apresentando ao longo da vida e entender isso  crucial para melhorarmos o relacionamento E a avanamos como ser humano,satisfação
Sempre fico com um p atrs quando o assunto so livros de autoajuda No entanto Como Fazer Amigos e Influenciar Pessoas acabou superando minhas expectativasComo  um livro com diversos captulos e subcaptulos fica fcil se organizar para llo No  uma leitura difcil porm  recomendado que a realize mais de uma vez dado que so abordados diversos tpicos em uma quantidade de pginas relativamente pequenaIndo direto ao ponto caso deseje aperfeioar seu modo de lidar com as pessoas sejam elas filhos pais empregados chefes etc Esse  o livro para voc,satisfação
T lutando pra terminar esse livro muito cansativo repetitivo demais Falto 15pg e tudo que deu pra absorver de bom foi 1 esperava muito mais Se voc no comprou no recomendo Muito clich,insatisfação
Seu contedo inicial e muito didtico e bem atual prende a ateno do leitor porm a medida que vai se prosseguindo aos captulos seguintes o tema comea a ser repetitivo e logo nos brasileiros notaremos que o autor narra estratgias que so muito mais aplicveis ao tipo de comportamento americano e ento o contedo fica desinteressante Esperava mais deste livro mais do mesmo,neutro
O livro  uma aula demonstrativa de aplicar empatia e boas maneiras Recomendado Sucesso centenrio,satisfação
Sem dvida um dos melhores livros que j li na vida Para quem acredita que com um titulo desse o livro ir tratar de manipulao e falsidade nas relaes humanas muito pelo contrrio Tratase de um livro que foca em como voc sendo verdadeiro e se colocando nos lugar das outras pessoas pode evoluir em diversos aspectos da vida,satisfação
Esse livro poderia ter 20 pginas O que a autora fala  interessante mas todo capitulo  igual exemplos e mais exemplos iguais teve captulos que pulei inteiro porque j sabia o que ia ser dito Recomendo pra quem tem pacincia de ler a mesma coisa por 250 pginas,insatisfação
Um livro para nos tornarmos pessoas melhores trazer  tona o olhar para o outro e tirar o que h de melhor nele  Vai fazer voc deixar de usar as tcnicas de relacionamento e sentir a essncia e a importncia de atravs da tcnica ter a oportunidade de ser e de fazer uma pessoa melhor,satisfação
 um bom livro mas nada de surpreendente Ensina sim algumas tcnicas para ter um bom relacionamento social mas acaba sendo enjoativo com tanto de exemplos que o autor aplica,satisfação
Boa noiteGostaria primeiramente em  agradecer o escritor deste livro Dale Carnegie  esse livro  uma obra prima muito bom Fcil de ler leve  bem escrito com bons exemplosSensacional,satisfação
Sinceramente foi o livro que mudou completamente minha vida Dale  diferenciado de todos do genero de desenvolvimento pessoal Comprem sem medo,satisfação
Comprei para presentear meu namorado o livro veio em perfeito estado ele amou e a embalagem de presente veio perfeita e a entrega foi super rpida,satisfação
Parabns pela entrega chegou antes da data prevista Quanto ao livro dispensa comentrios Excelente obra temuma abordagem excepcional de como construir ou manter relacionamento  ativo no campo social profissional ou familiar ,satisfação
Dei de presente pra minha irm ela amou,satisfação
Produto muito bom porm me decepcionei com a embalagem comprei 2 produtos e pedi duas embalagens de presente foi enviado tudo na mesma embalagem,satisfação
 Livro indispensvel para empreendedores vendedores e lderes,satisfação
Eu esperava mais por esse livroPor sem um exemplar com milhares vendidosNo gostei e  no indico,insatisfação
Um dos melhores livros que j li  Me abriu os olhos para detalhes e coisas que eu jamais reparei   muito enriquecedor e transformador toda pessoa deveria llo ,satisfação
Leitura fluida com informaes bem uteis e embasadas Recomendo,satisfação
Estou dando 5 estrelas pois esse livro contm vrias dicas de como se sair bem de qualquer situao que envolva o dilogo Pra mim ele  a a Bblia das relaes interpessoais,satisfação
Sem palavras queria ter lido este livro a uns 10 anos atrs muito enriquecedor,satisfação
Chegou embalado corretamente e todo lacrado Veio impecvel,satisfação
Livro muito bom mesmo,satisfação
Muito bom,satisfação
Leitura de fcil entendimento,satisfação
Produto chegou antes do prazo e com perfeita qualidade,satisfação
Te faz abrir a mente e pensar primeiramente no prximo ao invs de pensar em si mesmo,satisfação
Chegou rpido ainda estou no comeo do livro mais est me surpreendendo,satisfação
Bom,satisfação
Livro realmente surpreendente superou  muito minhas expectativas,satisfação
Algum me ajudaaaaa,insatisfação
Esse livro  um manual de comunicao assertiva Melhor livro que j li sobre o tema Recomendo,satisfação
Melhor livro que j li Mudou minha vida completamente ,satisfação
Muito bom chegou antes do prazoPerfeito,satisfação
Excelente produto,satisfação
timo livro,satisfação
Entrega e Livro excelentes,satisfação
Adorei a proposta do livro e os ensinamentos dirios dele Utilizo como um guia para ser uma pessoa melhor,satisfação
Apesar de o ego nem sempre deixar os ensinamentos do livro serem aplicados livro cheio de contedo muito bom Algumas coisas podem parecer lgicas mas tem coisa lgica que  bom a gente ler para ter mais peso Um livro que deveria ser obrigatrio para criarmos uma sociedade pelo menos mais agradvel de se viver,satisfação
Livro que nos faz refletir sobre como estamos nos nossos relacionamentos pessoais e profissionaisMuito booom acredito que todos devem ler,satisfação
Excelente,satisfação
Very good,satisfação
